{
  "schema_version": "agentcafe.diagnostic.v1",
  "trace_id": "trace-fixture-secret-redaction",
  "generated_at": "2026-06-28T08:00:00Z",
  "runtimes": [
    {
      "runtime": "codex",
      "display_name": "Codex",
      "executable_path": "~/redacted/bin/codex",
      "version": "0.138.0",
      "install_source": "npm",
      "path_status": "available",
      "status": "available",
      "detected_at": "2026-06-28T08:00:00Z",
      "diagnostics": []
    },
    {
      "runtime": "claude",
      "display_name": "Claude Code",
      "executable_path": "~/redacted/bin/claude",
      "version": "1.0.56",
      "install_source": "npm",
      "path_status": "available",
      "status": "available",
      "detected_at": "2026-06-28T08:00:00Z",
      "diagnostics": []
    }
  ],
  "config_sources": [
    {
      "id": "codex-user-config",
      "runtime": "codex",
      "scope": "user",
      "path": "~/redacted/.codex/config.toml",
      "priority": 40,
      "format": "toml",
      "read_policy": "read_whitelisted_fields",
      "display_policy": "redacted_summary",
      "write_policy": "mvp2_draft_only",
      "validation_status": "valid",
      "trust_status": "not_applicable",
      "mvp_stage": "mvp1_read_only",
      "source_reference": "https://developers.openai.com/codex/config-basic"
    },
    {
      "id": "claude-user-settings",
      "runtime": "claude",
      "scope": "user",
      "path": "~/redacted/.claude/settings.json",
      "priority": 30,
      "format": "json",
      "read_policy": "read_whitelisted_fields",
      "display_policy": "redacted_summary",
      "write_policy": "mvp2_draft_only",
      "validation_status": "valid",
      "trust_status": "not_applicable",
      "mvp_stage": "mvp1_read_only",
      "source_reference": "https://docs.anthropic.com/en/docs/claude-code/settings"
    }
  ],
  "plugins": [],
  "skills": [],
  "mcp_servers": [
    {
      "id": "codex-github",
      "runtime": "codex",
      "scope": "user",
      "transport": "stdio",
      "command_or_url_summary": "command:npx args:2 env_fields:1",
      "enabled": true,
      "connection_status": "not_tested",
      "tool_count": null,
      "resource_count": null,
      "template_count": null,
      "validation_status": "valid",
      "risk_count": 1
    },
    {
      "id": "claude-internal-docs",
      "runtime": "claude",
      "scope": "user",
      "transport": "http",
      "command_or_url_summary": "url:https://docs.example.invalid/redacted headers:1",
      "enabled": true,
      "connection_status": "not_tested",
      "tool_count": null,
      "resource_count": null,
      "template_count": null,
      "validation_status": "valid",
      "risk_count": 1
    }
  ],
  "hooks": [],
  "conflicts": [],
  "risk_findings": [
    {
      "code": "secret_like_value",
      "severity": "high",
      "source": "config",
      "runtime": "codex",
      "path": "~/redacted/.codex/config.toml",
      "message": "A secret-like field is present and will not be displayed.",
      "redacted_evidence": {
        "field": "mcp_servers.github.env.GITHUB_TOKEN",
        "length": 32,
        "sha256_12": "3b7d9f1a0c4e",
        "source_summary": "user config"
      },
      "recommended_action": "Move the value to the runtime's supported secret mechanism and keep it out of shared project files."
    },
    {
      "code": "authorization_header_present",
      "severity": "high",
      "source": "mcp",
      "runtime": "claude",
      "path": "~/redacted/.claude/settings.json",
      "message": "An authorization header field is present and will not be displayed.",
      "redacted_evidence": {
        "field": "mcpServers.internal.headers.Authorization",
        "length": 41,
        "sha256_12": "60f8d7ab12e9",
        "source_summary": "user settings"
      },
      "recommended_action": "Keep authorization headers in a local secret store or runtime-supported environment mechanism."
    },
    {
      "code": "primary_api_key_present",
      "severity": "high",
      "source": "config",
      "runtime": "claude",
      "path": "~/redacted/.claude/config.json",
      "message": "Claude primary API key presence was detected without reading the value.",
      "redacted_evidence": {
        "field": "primaryApiKey",
        "length": 0,
        "sha256_12": "000000000000",
        "source_summary": "presence only"
      },
      "recommended_action": "Do not copy this value into shared settings or diagnostic output."
    }
  ],
  "summary": {
    "runtime_count": 2,
    "config_source_count": 2,
    "plugin_count": 0,
    "skill_count": 0,
    "mcp_server_count": 2,
    "hook_count": 0,
    "risk_count_by_severity": {
      "info": 0,
      "low": 0,
      "medium": 0,
      "high": 3,
      "critical": 0
    },
    "overall_status": "available",
    "truncated": false
  },
  "redaction_notice": "Agent Cafe returns field names, counts, lengths, hashes, and redacted paths only. Secrets, prompts, transcripts, tool payloads, shell output, and nonce values are omitted."
}
