{
  "schema_version": "agentcafe.diagnostic.v1",
  "trace_id": "trace-fixture-dual-runtime",
  "generated_at": "2026-06-28T08:00:00Z",
  "runtimes": [
    {
      "runtime": "codex",
      "display_name": "Codex",
      "executable_path": "~/redacted/bin/codex",
      "version": "0.138.0",
      "install_source": "npm",
      "path_status": "available",
      "status": "available",
      "detected_at": "2026-06-28T08:00:00Z",
      "diagnostics": []
    },
    {
      "runtime": "claude",
      "display_name": "Claude Code",
      "executable_path": "~/redacted/bin/claude",
      "version": "1.0.56",
      "install_source": "npm",
      "path_status": "available",
      "status": "available",
      "detected_at": "2026-06-28T08:00:00Z",
      "diagnostics": []
    }
  ],
  "config_sources": [
    {
      "id": "codex-user-config",
      "runtime": "codex",
      "scope": "user",
      "path": "~/redacted/.codex/config.toml",
      "priority": 40,
      "format": "toml",
      "read_policy": "read_whitelisted_fields",
      "display_policy": "redacted_summary",
      "write_policy": "mvp2_draft_only",
      "validation_status": "valid",
      "trust_status": "not_applicable",
      "mvp_stage": "mvp1_read_only",
      "source_reference": "https://developers.openai.com/codex/config-basic"
    },
    {
      "id": "codex-project-config",
      "runtime": "codex",
      "scope": "project",
      "path": "~/redacted/workspace/.codex/config.toml",
      "priority": 50,
      "format": "toml",
      "read_policy": "read_whitelisted_fields_when_trusted",
      "display_policy": "redacted_summary",
      "write_policy": "mvp2_draft_only",
      "validation_status": "valid",
      "trust_status": "trusted",
      "mvp_stage": "mvp1_read_only",
      "source_reference": "https://developers.openai.com/codex/config-basic"
    },
    {
      "id": "claude-user-settings",
      "runtime": "claude",
      "scope": "user",
      "path": "~/redacted/.claude/settings.json",
      "priority": 30,
      "format": "json",
      "read_policy": "read_whitelisted_fields",
      "display_policy": "redacted_summary",
      "write_policy": "mvp2_draft_only",
      "validation_status": "valid",
      "trust_status": "not_applicable",
      "mvp_stage": "mvp1_read_only",
      "source_reference": "https://docs.anthropic.com/en/docs/claude-code/settings"
    }
  ],
  "plugins": [
    {
      "id": "codex-plugin-sample",
      "runtime": "codex",
      "name": "sample-plugin",
      "version": "0.1.0",
      "scope": "user",
      "source": "plugin manifest",
      "path": "~/redacted/.codex/plugins/sample-plugin/plugin.json",
      "enabled": true,
      "validation_status": "valid",
      "capabilities": ["skills", "mcp"],
      "risk_count": 0
    }
  ],
  "skills": [
    {
      "id": "codex-skill-plan",
      "runtime": "codex",
      "name": "plan",
      "description": "Planning helper frontmatter summary.",
      "scope": "plugin",
      "path": "~/redacted/.codex/plugins/sample-plugin/skills/plan/SKILL.md",
      "validation_status": "valid",
      "referenced_resource_count": 1,
      "risk_count": 0
    },
    {
      "id": "claude-skill-review",
      "runtime": "claude",
      "name": "review",
      "description": "Review helper frontmatter summary.",
      "scope": "user",
      "path": "~/redacted/.claude/skills/review/SKILL.md",
      "validation_status": "valid",
      "referenced_resource_count": 2,
      "risk_count": 0
    }
  ],
  "mcp_servers": [
    {
      "id": "codex-filesystem",
      "runtime": "codex",
      "scope": "project",
      "transport": "stdio",
      "command_or_url_summary": "command:npx args:3 cwd:~/redacted/workspace",
      "enabled": true,
      "connection_status": "not_tested",
      "tool_count": null,
      "resource_count": null,
      "template_count": null,
      "validation_status": "valid",
      "risk_count": 0
    },
    {
      "id": "claude-docs",
      "runtime": "claude",
      "scope": "project",
      "transport": "http",
      "command_or_url_summary": "url:https://docs.example.invalid/redacted",
      "enabled": true,
      "connection_status": "not_tested",
      "tool_count": null,
      "resource_count": null,
      "template_count": null,
      "validation_status": "valid",
      "risk_count": 0
    }
  ],
  "hooks": [
    {
      "id": "claude-project-post-tool-use",
      "runtime": "claude",
      "scope": "project",
      "event": "PostToolUse",
      "matcher": "Write",
      "handler_type": "command",
      "command_summary": "command:node args:1",
      "enabled": true,
      "trust_status": "trusted",
      "validation_status": "valid",
      "risk_count": 1
    }
  ],
  "conflicts": [
    {
      "runtime": "codex",
      "key": "model",
      "winning_source_id": "codex-project-config",
      "shadowed_source_ids": ["codex-user-config"],
      "explanation": "Project config has higher precedence than user config when the project is trusted."
    }
  ],
  "risk_findings": [
    {
      "code": "hook_executes_command",
      "severity": "medium",
      "source": "hook",
      "runtime": "claude",
      "path": "~/redacted/workspace/.claude/settings.json",
      "message": "A hook declares an external command. MVP 1 reports metadata only and does not execute it.",
      "redacted_evidence": {
        "field": "hooks.PostToolUse.hooks.0.command",
        "length": 18,
        "sha256_12": "5a4e98d2c6b1",
        "source_summary": "project settings"
      },
      "recommended_action": "Review the hook command in the runtime's own configuration before enabling write or test workflows."
    }
  ],
  "summary": {
    "runtime_count": 2,
    "config_source_count": 3,
    "plugin_count": 1,
    "skill_count": 2,
    "mcp_server_count": 2,
    "hook_count": 1,
    "risk_count_by_severity": {
      "info": 0,
      "low": 0,
      "medium": 1,
      "high": 0,
      "critical": 0
    },
    "overall_status": "available",
    "truncated": false
  },
  "redaction_notice": "Agent Cafe returns field names, counts, lengths, hashes, and redacted paths only. Secrets, prompts, transcripts, tool payloads, shell output, and nonce values are omitted."
}
