{
  "schema_version": "agentcafe.diagnostic.v1",
  "trace_id": "trace-fixture-permission-denied",
  "generated_at": "2026-06-28T08:00:00Z",
  "runtimes": [
    {
      "runtime": "codex",
      "display_name": "Codex",
      "executable_path": "~/redacted/bin/codex",
      "version": "0.138.0",
      "install_source": "npm",
      "path_status": "available",
      "status": "available",
      "detected_at": "2026-06-28T08:00:00Z",
      "diagnostics": []
    },
    {
      "runtime": "claude",
      "display_name": "Claude Code",
      "executable_path": "~/redacted/bin/claude",
      "version": "1.0.56",
      "install_source": "npm",
      "path_status": "available",
      "status": "available",
      "detected_at": "2026-06-28T08:00:00Z",
      "diagnostics": []
    }
  ],
  "config_sources": [
    {
      "id": "codex-user-config",
      "runtime": "codex",
      "scope": "user",
      "path": "~/redacted/.codex/config.toml",
      "priority": 40,
      "format": "toml",
      "read_policy": "read_whitelisted_fields",
      "display_policy": "redacted_summary",
      "write_policy": "mvp2_draft_only",
      "validation_status": "valid",
      "trust_status": "not_applicable",
      "mvp_stage": "mvp1_read_only",
      "source_reference": "https://developers.openai.com/codex/config-basic"
    },
    {
      "id": "claude-managed-settings",
      "runtime": "claude",
      "scope": "managed",
      "path": "~/redacted/managed-settings.json",
      "priority": 60,
      "format": "json",
      "read_policy": "detect_only_after_permission_error",
      "display_policy": "redacted_summary",
      "write_policy": "read_only",
      "validation_status": "skipped",
      "trust_status": "managed",
      "mvp_stage": "mvp1_read_only",
      "source_reference": "https://docs.anthropic.com/en/docs/claude-code/settings"
    }
  ],
  "plugins": [],
  "skills": [],
  "mcp_servers": [],
  "hooks": [],
  "conflicts": [],
  "risk_findings": [
    {
      "code": "permission_denied",
      "severity": "medium",
      "source": "config",
      "runtime": "claude",
      "path": "~/redacted/managed-settings.json",
      "message": "A configuration source exists but could not be read with current permissions.",
      "redacted_evidence": null,
      "recommended_action": "Retry after granting the operating system permission or inspect the managed policy with an administrator."
    }
  ],
  "summary": {
    "runtime_count": 2,
    "config_source_count": 2,
    "plugin_count": 0,
    "skill_count": 0,
    "mcp_server_count": 0,
    "hook_count": 0,
    "risk_count_by_severity": {
      "info": 0,
      "low": 0,
      "medium": 1,
      "high": 0,
      "critical": 0
    },
    "overall_status": "blocked",
    "truncated": false
  },
  "redaction_notice": "Agent Cafe returns field names, counts, lengths, hashes, and redacted paths only. Secrets, prompts, transcripts, tool payloads, shell output, and nonce values are omitted."
}
