{
  "schema_version": "agentcafe.diagnostic.v1",
  "trace_id": "trace-20260628-0001",
  "generated_at": "2026-06-28T08:00:00Z",
  "runtimes": [
    {
      "runtime": "codex",
      "display_name": "Codex",
      "executable_path": "/usr/local/bin/codex",
      "version": "0.138.0",
      "install_source": "npm",
      "path_status": "available",
      "status": "available",
      "detected_at": "2026-06-28T08:00:00Z",
      "diagnostics": []
    },
    {
      "runtime": "claude",
      "display_name": "Claude Code",
      "executable_path": null,
      "version": "unknown",
      "install_source": "unknown",
      "path_status": "missing",
      "status": "missing",
      "detected_at": "2026-06-28T08:00:00Z",
      "diagnostics": [
        {
          "code": "runtime_not_found",
          "message": "claude was not found on PATH or known install locations."
        }
      ]
    }
  ],
  "config_sources": [
    {
      "id": "codex-user-config",
      "runtime": "codex",
      "scope": "user",
      "path": "~/redacted/.codex/config.toml",
      "priority": 40,
      "format": "toml",
      "read_policy": "read_whitelisted_fields",
      "display_policy": "redacted_summary",
      "write_policy": "mvp2_draft_only",
      "validation_status": "valid",
      "trust_status": "not_applicable",
      "mvp_stage": "mvp1_read_only",
      "source_reference": "https://developers.openai.com/codex/config-basic"
    }
  ],
  "plugins": [],
  "skills": [],
  "mcp_servers": [],
  "hooks": [],
  "conflicts": [
    {
      "runtime": "codex",
      "key": "model",
      "winning_source_id": "codex-user-config",
      "shadowed_source_ids": [],
      "explanation": "Only one source defines this key in the sample report."
    }
  ],
  "risk_findings": [
    {
      "code": "secret_like_value",
      "severity": "high",
      "source": "config",
      "runtime": "codex",
      "path": "~/redacted/.codex/config.toml",
      "message": "A secret-like field is present and will not be displayed.",
      "redacted_evidence": {
        "field": "mcp_servers.github.env.GITHUB_TOKEN",
        "length": 40,
        "sha256_12": "3b7d9f1a0c4e",
        "source_summary": "user config"
      },
      "recommended_action": "Move the value to the runtime's supported secret mechanism and keep it out of shared project files."
    }
  ],
  "summary": {
    "runtime_count": 1,
    "config_source_count": 1,
    "plugin_count": 0,
    "skill_count": 0,
    "mcp_server_count": 0,
    "hook_count": 0,
    "risk_count_by_severity": {
      "info": 0,
      "low": 0,
      "medium": 0,
      "high": 1,
      "critical": 0
    },
    "overall_status": "available",
    "truncated": false
  },
  "redaction_notice": "Agent Cafe returns field names, counts, lengths, hashes, and redacted paths only. Secrets, prompts, transcripts, tool payloads, shell output, and nonce values are omitted."
}
